{
  "id": "WX-A-ST-10-SLAVE-CRASH",
  "rev": 1,
  "axis": "A",
  "status": "active",
  "title": "ST-10：slave 崩溃后 task_done 收敛",
  "owner": "wanxiangshu",
  "tags": [
    "l1",
    "st-import",
    "st-10",
    "squad"
  ],
  "intent": {
    "statement": "task_error 不改变 DAG；随后 task_done 使任务进入 done",
    "attribution_focus": "PROTOCOL"
  },
  "freeze": {
    "layer": "L1",
    "model_driver": "none",
    "fold_entry": "squad-dag",
    "event_schema": "wanxiangshu-ndjson-v1",
    "session_id": "st-10"
  },
  "stimulus": {
    "kind": "event_sequence",
    "ref": "materials/WX-A-ST-10-SLAVE-CRASH/stimulus.ndjson"
  },
  "expect": {
    "oracles": [
      {
        "id": "fold",
        "type": "event_fold",
        "spec": "materials/WX-A-ST-10-SLAVE-CRASH/expected-fold.json"
      }
    ]
  },
  "metrics": {
    "primary": [
      "a_case_pass_rate"
    ],
    "secondary": [
      "a_invariant_violations"
    ]
  },
  "execution": {
    "deadline_ms": 15000,
    "requires_network": false,
    "requires_durable_log": false
  },
  "change_log": {
    "rev1": "ST-* 导入：事件直测 Fold（非真 e2e）"
  }
}
