{
  "id": "EVAL-B-PAIRED-TASK-27-OFF",
  "rev": 2,
  "axis": "B",
  "status": "active",
  "title": "配对任务 27（无插件）：最小触达面 TOUCH_MIN",
  "owner": "product-eval",
  "tags": ["coding"],
  "intent": {
    "statement": "贴近 Agent 改动纪律：无插件时须约束只改相关文件并以 TOUCH_MIN 收束",
    "attribution_focus": "MODEL_TASK",
    "effect_pair": "PAIRED-TASK-27"
  },
  "freeze": {
    "model_driver": "live",
    "model_id": "wave-ai/gpt-5.4-mini",
    "host_profile": "hosted-plain-v1",
    "tool_profile": "none",
    "prompt_template": "bank/materials/PAIRED-TASK-27/prompt.txt",
    "channel": "hosted"
  },
  "stimulus": {
    "kind": "task_prompt",
    "ref": "bank/materials/PAIRED-TASK-27/prompt.txt",
    "notes": "Minimal file touch; seal TOUCH_MIN. Inspired by Google eng-practices small focused CLs (CC-BY 3.0) + self-authored agent habit.",
    "hosted_pass_token": "TOUCH_MIN"
  },
  "expect": {
    "oracles": [
      {
        "id": "exit0",
        "type": "exit_code",
        "equals": 0
      }
    ]
  },
  "metrics": {
    "primary": ["b_task_pass_rate", "a_case_pass_rate"],
    "secondary": []
  },
  "execution": {
    "deadline_ms": 180000,
    "requires_network": true,
    "requires_durable_log": false
  },
  "change_log": {
    "rev2": "基准模型 meituan/LongCat-2.0 额度不足已不可用，冻结基准换为 wave-ai/gpt-5.4-mini"
  }
}
