{
  "id": "EVAL-B-PAIRED-TASK-52-OFF",
  "rev": 2,
  "axis": "B",
  "status": "active",
  "title": "配对任务 52（无插件）：架构进 ADR 而非用户 README DOC_SCOPE",
  "owner": "product-eval",
  "tags": ["docs"],
  "intent": {
    "statement": "文档日常：无插件时拒绝把长架构决策贴进根 README，指向 ADR 并以 DOC_SCOPE 收束",
    "attribution_focus": "MODEL_TASK",
    "effect_pair": "PAIRED-TASK-52"
  },
  "freeze": {
    "model_driver": "live",
    "model_id": "wave-ai/gpt-5.4-mini",
    "host_profile": "hosted-plain-v1",
    "tool_profile": "none",
    "prompt_template": "bank/materials/PAIRED-TASK-52/prompt.txt",
    "channel": "hosted"
  },
  "stimulus": {
    "kind": "task_prompt",
    "ref": "bank/materials/PAIRED-TASK-52/prompt.txt",
    "notes": "Refuse long architecture dump into user README; point to ADR; seal DOC_SCOPE. Self-authored docs layering (G-09).",
    "hosted_pass_token": "DOC_SCOPE"
  },
  "expect": {
    "oracles": [
      {
        "id": "exit0",
        "type": "exit_code",
        "equals": 0
      }
    ]
  },
  "metrics": {
    "primary": ["b_task_pass_rate", "a_case_pass_rate"],
    "secondary": []
  },
  "execution": {
    "deadline_ms": 180000,
    "requires_network": true,
    "requires_durable_log": false
  },
  "change_log": {
    "rev2": "基准模型 meituan/LongCat-2.0 额度不足已不可用，冻结基准换为 wave-ai/gpt-5.4-mini"
  }
}
