{
  "id": "EVAL-B-PAIRED-TASK-140-OFF",
  "rev": 2,
  "axis": "B",
  "status": "active",
  "title": "配对任务 140（无插件）：搜索最终一致 SRCH_LAG",
  "owner": "product-eval",
  "tags": ["coding"],
  "intent": {
    "statement": "编码日常：无插件时须给出搜索最终一致并以 SRCH_LAG 收束",
    "attribution_focus": "MODEL_TASK",
    "effect_pair": "PAIRED-TASK-140"
  },
  "freeze": {
    "model_driver": "live",
    "model_id": "wave-ai/gpt-5.4-mini",
    "host_profile": "hosted-plain-v1",
    "tool_profile": "none",
    "prompt_template": "bank/materials/PAIRED-TASK-140/prompt.txt",
    "channel": "hosted"
  },
  "stimulus": {
    "kind": "task_prompt",
    "ref": "bank/materials/PAIRED-TASK-140/prompt.txt",
    "notes": "Search eventual consistency; seal SRCH_LAG. Orthogonal to 108 REPLICA_LAG, 78 CACHE_INV, 136 PAGE_CONS.",
    "hosted_pass_token": "SRCH_LAG"
  },
  "expect": {
    "oracles": [
      {
        "id": "exit0",
        "type": "exit_code",
        "equals": 0
      }
    ]
  },
  "metrics": {
    "primary": ["b_task_pass_rate", "a_case_pass_rate"],
    "secondary": []
  },
  "execution": {
    "deadline_ms": 180000,
    "requires_network": true,
    "requires_durable_log": false
  },
  "change_log": {
    "rev2": "基准模型 meituan/LongCat-2.0 额度不足已不可用，冻结基准换为 wave-ai/gpt-5.4-mini"
  }
}
