{
  "id": "DEMO-B-TOOL-SCHEMA-03",
  "rev": 1,
  "axis": "B",
  "status": "active",
  "title": "模型矩阵夹具题 03：须调用 todowrite 并填齐必填字段",
  "owner": "demo",
  "tags": ["schema", "matrix", "fixture"],
  "intent": {
    "statement": "B-direct fixture 矩阵扩充（切片 5 spike，无 API）",
    "attribution_focus": "MODEL_SCHEMA"
  },
  "freeze": {
    "model_driver": "live",
    "model_id": "${MATRIX_SUBJECT}",
    "host_profile": "model-direct-v1",
    "tool_profile": "recorded-tools-v1",
    "prompt_template": "multi-step-task-v1",
    "channel": "direct"
  },
  "stimulus": {
    "kind": "task_prompt",
    "ref": "materials/DEMO-B-TOOL-SCHEMA-03/task.md"
  },
  "expect": {
    "oracles": [
      { "id": "must-call", "type": "tool_trace", "must_call": ["todowrite"] },
      {
        "id": "required-fields",
        "type": "schema_obedience",
        "tool": "todowrite",
        "required_fields": ["todos", "merge"]
      }
    ]
  },
  "metrics": {
    "primary": ["b_schema_obedience_rate", "b_required_tool_call_rate"],
    "secondary": ["b_invalid_args_rate"]
  },
  "execution": {
    "deadline_ms": 180000,
    "requires_network": true,
    "repeats": 3
  }
}
