{
  "id": "EVAL-B-PAIRED-TASK-25-ON",
  "rev": 3,
  "axis": "B",
  "status": "active",
  "title": "配对任务 25（有插件）：Conventional Commit 单行 COMMIT_OK + NDJSON",
  "owner": "product-eval",
  "tags": ["coding"],
  "intent": {
    "statement": "与 OFF 同任务；挂万象术后应 COMMIT_OK 收束并产生 assistant_completed",
    "attribution_focus": "PROTOCOL",
    "effect_pair": "PAIRED-TASK-25",
    "protocol_probes": ["RuntimeStarted", "JournalEnvelope"]
  },
  "freeze": {
    "model_driver": "live",
    "model_id": "wave-ai/gpt-5.4-mini",
    "host_profile": "hosted-plugin-v1",
    "tool_profile": "none",
    "prompt_template": "bank/materials/PAIRED-TASK-25/prompt.txt",
    "channel": "hosted"
  },
  "stimulus": {
    "kind": "task_prompt",
    "ref": "bank/materials/PAIRED-TASK-25/prompt.txt",
    "notes": "Conventional Commits subject line; seal COMMIT_OK. Adapted from Conventional Commits v1.0.0 (MIT).",
    "hosted_pass_token": "COMMIT_OK"
  },
  "expect": {
    "oracles": [
      {
        "id": "exit0",
        "type": "exit_code",
        "equals": 0
      }
    ]
  },
  "metrics": {
    "primary": ["b_task_pass_rate", "a_case_pass_rate"],
    "secondary": ["a_invariant_violations"]
  },
  "execution": {
    "deadline_ms": 180000,
    "requires_network": true,
    "requires_durable_log": true
  },
  "change_log": {
    "rev2": "基准模型 meituan/LongCat-2.0 额度不足已不可用，冻结基准换为 wave-ai/gpt-5.4-mini",
    "rev3": "协议探针换血：assistant_completed 属万象术 0.8 前 NDJSON 面，已消失；改用 2026-08-31 hosted 真跑实测命中的 EventStore Kind（RuntimeStarted / JournalEnvelope）"
  }
}
