{
  "id": "WX-C-ST-12-CLEANUP-MERGED",
  "rev": 1,
  "axis": "C",
  "status": "active",
  "title": "ST-12：merged 后清理 worktree/分支",
  "owner": "wanxiangshu",
  "tags": ["c-axis", "st-12", "git"],
  "intent": {
    "statement": "merged 场景下真 git worktree 与任务分支被删除",
    "attribution_focus": "TOOL"
  },
  "freeze": {
    "model_driver": "none",
    "model_id": "n/a",
    "host_profile": "git-coordinator-v1",
    "tool_profile": "st-12-cleanup",
    "prompt_template": "n/a"
  },
  "stimulus": {
    "kind": "tool_args",
    "ref": "materials/WX-C-ST-12-CLEANUP-MERGED/stimulus.json"
  },
  "expect": {
    "oracles": [
      { "id": "exit0", "type": "exit_code", "equals": 0 },
      {
        "id": "result",
        "type": "tool_result_equals",
        "equals": {
          "scenario": "merged",
          "worktreeRemoved": true,
          "branchRemoved": true
        }
      }
    ]
  },
  "metrics": { "primary": ["c_contract_pass_rate"] },
  "execution": { "deadline_ms": 30000, "requires_network": false }
}
