{
  "id": "WX-C-ST-09-RECONCILE",
  "rev": 1,
  "axis": "C",
  "status": "active",
  "title": "ST-09：git 事实校正（tip 已在主线）",
  "owner": "wanxiangshu",
  "tags": ["c-axis", "st-09", "git"],
  "intent": {
    "statement": "任务 tip 已 ff 进 main 时，应校正 Submitted→Merged",
    "attribution_focus": "TOOL"
  },
  "freeze": {
    "model_driver": "none",
    "model_id": "n/a",
    "host_profile": "git-coordinator-v1",
    "tool_profile": "st-09-reconcile",
    "prompt_template": "n/a"
  },
  "stimulus": {
    "kind": "tool_args",
    "ref": "materials/WX-C-ST-09-RECONCILE/stimulus.json"
  },
  "expect": {
    "oracles": [
      { "id": "exit0", "type": "exit_code", "equals": 0 },
      {
        "id": "result",
        "type": "tool_result_equals",
        "equals": {
          "tipInMain": true,
          "shouldReconcileSubmittedToMerged": true
        }
      }
    ]
  },
  "metrics": { "primary": ["c_contract_pass_rate"] },
  "execution": { "deadline_ms": 30000, "requires_network": false }
}
