{
  "id": "EVAL-B-PAIRED-TASK-56-OFF",
  "rev": 2,
  "axis": "B",
  "status": "active",
  "title": "配对任务 56（无插件）：实现步骤与接口契约收束 IMPL_STEPS",
  "owner": "product-eval",
  "tags": ["coding"],
  "intent": {
    "statement": "编码日常：无插件时须给出可执行实现步骤与一句接口契约并以 IMPL_STEPS 收束，禁止空泛口号",
    "attribution_focus": "MODEL_TASK",
    "effect_pair": "PAIRED-TASK-56"
  },
  "freeze": {
    "model_driver": "live",
    "model_id": "wave-ai/gpt-5.4-mini",
    "host_profile": "hosted-plain-v1",
    "tool_profile": "none",
    "prompt_template": "bank/materials/PAIRED-TASK-56/prompt.txt",
    "channel": "hosted"
  },
  "stimulus": {
    "kind": "task_prompt",
    "ref": "bank/materials/PAIRED-TASK-56/prompt.txt",
    "notes": "Concrete implement steps + one contract line; seal IMPL_STEPS. Self-authored coding-daily fill for 07 encoding gap.",
    "hosted_pass_token": "IMPL_STEPS"
  },
  "expect": {
    "oracles": [
      {
        "id": "exit0",
        "type": "exit_code",
        "equals": 0
      }
    ]
  },
  "metrics": {
    "primary": ["b_task_pass_rate", "a_case_pass_rate"],
    "secondary": []
  },
  "execution": {
    "deadline_ms": 180000,
    "requires_network": true,
    "requires_durable_log": false
  },
  "change_log": {
    "rev2": "基准模型 meituan/LongCat-2.0 额度不足已不可用，冻结基准换为 wave-ai/gpt-5.4-mini"
  }
}
