{
  "id": "EVAL-B-PAIRED-TASK-35-OFF",
  "rev": 2,
  "axis": "B",
  "status": "active",
  "title": "配对任务 35（无插件）：估时区间与风险 ESTIMATE_OK",
  "owner": "product-eval",
  "tags": ["coding"],
  "intent": {
    "statement": "贴近估时沟通：无插件时须给出区间与风险并以 ESTIMATE_OK 收束",
    "attribution_focus": "MODEL_TASK",
    "effect_pair": "PAIRED-TASK-35"
  },
  "freeze": {
    "model_driver": "live",
    "model_id": "wave-ai/gpt-5.4-mini",
    "host_profile": "hosted-plain-v1",
    "tool_profile": "none",
    "prompt_template": "bank/materials/PAIRED-TASK-35/prompt.txt",
    "channel": "hosted"
  },
  "stimulus": {
    "kind": "task_prompt",
    "ref": "bank/materials/PAIRED-TASK-35/prompt.txt",
    "notes": "Honest estimate range + risk; seal ESTIMATE_OK. Inspired engineering practice; not a proprietary framework.",
    "hosted_pass_token": "ESTIMATE_OK"
  },
  "expect": {
    "oracles": [
      {
        "id": "exit0",
        "type": "exit_code",
        "equals": 0
      }
    ]
  },
  "metrics": {
    "primary": ["b_task_pass_rate", "a_case_pass_rate"],
    "secondary": []
  },
  "execution": {
    "deadline_ms": 180000,
    "requires_network": true,
    "requires_durable_log": false
  },
  "change_log": {
    "rev2": "基准模型 meituan/LongCat-2.0 额度不足已不可用，冻结基准换为 wave-ai/gpt-5.4-mini"
  }
}
