{
  "id": "EVAL-B-PAIRED-TASK-17-OFF",
  "rev": 2,
  "axis": "B",
  "status": "active",
  "title": "配对任务 17（无插件）：闲聊不调工具 TOOL_SKIP",
  "owner": "product-eval",
  "tags": ["tool"],
  "intent": {
    "statement": "工具相关性：无插件时面对闲聊须声明不调工具并以 TOOL_SKIP 收束",
    "attribution_focus": "MODEL_TASK",
    "effect_pair": "PAIRED-TASK-17"
  },
  "freeze": {
    "model_driver": "live",
    "model_id": "wave-ai/gpt-5.4-mini",
    "host_profile": "hosted-plain-v1",
    "tool_profile": "none",
    "prompt_template": "bank/materials/PAIRED-TASK-17/prompt.txt",
    "channel": "hosted"
  },
  "stimulus": {
    "kind": "task_prompt",
    "ref": "bank/materials/PAIRED-TASK-17/prompt.txt",
    "notes": "Call vs Not Call; seal TOOL_SKIP. Inspired by EvalScope general_fc negative sample + BFCL irrelevance (Apache-2.0).",
    "hosted_pass_token": "TOOL_SKIP"
  },
  "expect": {
    "oracles": [
      {
        "id": "exit0",
        "type": "exit_code",
        "equals": 0
      }
    ]
  },
  "metrics": {
    "primary": ["b_task_pass_rate", "a_case_pass_rate"],
    "secondary": []
  },
  "execution": {
    "deadline_ms": 180000,
    "requires_network": true,
    "requires_durable_log": false
  },
  "change_log": {
    "rev2": "基准模型 meituan/LongCat-2.0 额度不足已不可用，冻结基准换为 wave-ai/gpt-5.4-mini"
  }
}
